,date,review,rating,isEdited,userName,title,developerResponse
813,2022-05-13 21:50:23,Poor help support…they just send form letters from their help menu..which if already read provide no help at all. Definitely deleting account,1,False,NeuroticGOD,User unfriendly,
814,2021-07-07 14:54:29,Best place for any TTRP players to get spin-off book of they’re favorite TTRPG.,5,False,AjaxHogan22,MindBlow,
815,2021-06-02 20:11:08,i love kickstarter but the app has an issue with apple pay and pledging. i tried multiple times to use apple pay and it never got through. hopefully im not overcharged. it only goes through with a card you add personally to the app itself,3,False,ghibliava,buggy,
816,2021-02-23 17:15:49,Can’t open the app for more than a minute without crashing. Every other update they break the app and take weeks to fix it. They clearly don’t give a crap about backers or creators.,1,False,jmfeeney35,Garbage,
817,2020-02-23 18:25:41,"I think you should hire a few more designers who have no idea how the average person uses an app.  With just a bit more cumbersome approach you can make it so no one can get anything, or contribute what they want.",1,False,Really a Rip Off,Cumbersome,
818,2019-09-13 15:22:25,"Can no longer have anything to do with Kickstarter. Account and app deleted.

Union busting gets what it deserves.",4,False,CaptainFearful,Union busting...,
819,2020-11-20 10:22:17,"Kickstarter is a joke, had 2 projects that were scams and they did nothing about it, now I’m out of my money. Do not use this app!!!! They steal from you!! I wish Apple would let you give negative stars",1,False,Mattin20,What a joke,
820,2019-08-22 03:38:22,"..... and, maybe, a few for myself : )",5,False,MtLaurelMooseKnuckle,My Favorite Way To Find Awesome Gifts For Friends !!!,
821,2022-11-04 18:23:48,"I can’t wait for the 3rd installment of the fractured shards universe, vol 1 & 2 are amazing!👏👏",5,False,jbowerize,Aquila,
822,2017-11-15 12:55:50,Why did you change this at all?  Can’t find it the icon without the green color.  And it crashes.  Terrible.,1,False,Keystone72,New version crashes before you can view a campaign,"{'id': 1824135, 'body': 'Hi there, thanks for reporting this issue. We fixed this in our latest release, so the app should stop crashing once you update to the new version. Thanks!', 'modified': '2017-11-22T18:17:28Z'}"
823,2023-09-30 06:47:51,No dark mode. No default page from settings of what subcategory and filter I want.,2,False,Zen123521234,No dark mode,"{'id': 39464813, 'body': 'Hi Zen123521234,\nThanks for sharing that this feature is something you’d want as part of our app. We are already cooking something up for this and feedback like yours is what helps us improve. We appreciate you being an active member of our community and we’re excited to keep making our app better for you.', 'modified': '2023-10-12T01:37:03Z'}"
824,2023-02-24 19:50:10,"Kickstarter is a great idea that has brought a lot of good products to life, BUT they offer ZERO support or responsibility against scammers. It seems I just lost a few hundred bucks here in a campaign fully funded.",1,False,netmx,Beware of scammers,
825,2019-11-04 12:19:00,This site give hours of enjoyment.,5,False,DHRoseberry,Be careful,
826,2022-05-17 02:06:37,These people allow scammers to fraud us out if money and do absolutely nothing when they don't fulfill the Kickstarter. I've been scammed 3 times. Never again. I don't care how great it sounds.,1,False,VALPONSSUX,Legal SCAM!!,
827,2022-02-22 02:02:10,Needs dark mode! I would browse much more but too bright at night!,3,False,JPMiller11,DM,
828,2021-07-15 03:05:53,Trying to email them or message the for help don’t get your hope up for a reply if a bot can not awnser you’d have a better go sticking a banana in your ear.,1,False,sabastion.review.,Don’t expect a reply,
829,2019-09-29 23:47:18,"Theses games have great graphics, instructions, and fun to play!!!",5,False,TPayne110,Great games,
830,2023-06-13 15:15:16,What even is the point of having an app if there is no option to see your own project?,1,False,Mwwww4736,Doesn’t show the project I created,
831,2020-07-01 11:45:21,"Kickstarter should make donating more like bidding, so that competitive donors can keep upping their contribution in the hopes of being top dog. This secret donation amount thing is for the birds.",3,False,Chalkfields,Kickstarter Competition,
832,2019-10-20 14:03:25,"I am a super backer with over 100 backed projects.  Then Kickstarter fired employees for trying to unionize.  Do not support them, I know I will not.  I cancelled around 10 projects and now I’m deleting the app.",2,False,carpecanum,Unions and America,
833,2019-09-30 16:51:13,Kickstarter was great in the beginning.  I got to be in on some really cool stuff that I see in stores.   Now it’s full of scams and Kickstarter gives the backer no recourse other than to lose their money when they buy into a scam project.  BUYER BEWARE.  Not worth it.,1,False,sweetgolden20,Full of Scams,
834,2019-08-28 08:23:53,To access Kickstarter. No complaints. Usable!,5,False,Cambridge Reader,Pretty good way...,
835,2019-09-29 05:28:15,"Kickstarters leadership has come out as anti-union, and I’d rather not support them any longer. As a backer of over 30 projects and a successful campaign creator myself, I’m disappointed.",1,False,Bogie0000,I’m trying not support those that don’t support their workers.,
836,2017-11-23 00:16:58,So nice that the projects are successful and don’t just take your money and disappear like on  Indegogo,4,False,Slow bee,Love it,
837,2018-05-07 23:36:31,At first I loved it. I got to help people in there projects or visions come to life then it took a few bad apples to F it up to the rest of the good people I’ve wanted to help back. Kickstarter will not help the people who get screwed they already got their percentage.,1,False,Eric Corey,Backers beware,
838,2024-03-16 00:04:04,Very poor customer service. Unable to make smooth payment process. Very unflexible,2,False,Gyroguy999,Billing,"{'id': 42685898, 'body': ""Hi there,\n\nSorry to hear about these difficulties. Please get in touch at app@kickstarter.com and we'll be happy to investigate further!\n\nBest,\nKickstarter Support"", 'modified': '2024-03-19T12:39:50Z'}"
839,2023-12-02 22:02:13,There are so many scam products that do not even ship. Kickstarter does not help backer with any sort of claim or holds anyone accountable for their products. Unless it’s a reputable company don’t back them.,1,False,RATAATAAT,Bad experiences,
840,2018-05-25 21:22:48,We need like $50 motion capture system in infinity war and render farm. :),5,False,RatTinyCar,Motion Capture,
841,2022-05-04 16:39:21,"I redownloaded the app, wouldn’t load at all. Deleted and downloaded it again, still not loading at all. Pretty disappointed.",1,False,Alexisislame,Not working,
842,2021-05-07 20:38:30,I love supporting start ups.  What I didn’t appreciate was being thoroughly dismissed the one time I’ve asked for Kickstarter’s support when backers were scammed with the easy wash.,1,False,jiioasis,Poor support,
843,2019-10-02 17:49:41,"don’t be those jerks who fight it. stronger united workers can be stronger and united for the company too, if you don’t whine like crybabies about the fact they want to be able to live healthfully while they work.",1,False,its always subjunctive,"Oooh voluntarily recognize the union, you cowards!",
844,2019-05-16 02:11:52,"Early on, I had good success with KS projects. Sadly, the last few have all failed ... take money and ghost. An idea that has been taken over by the dishonest or incapable. No more.",1,False,JimmyTr,"Two failed projects, I am done",
845,2022-10-30 11:12:58,Glad to see Kickstarter is standing up for Loona,5,False,zedd PR,Loona,
846,2022-12-14 00:35:19,"Just a bunch of scammers. Buy real products from a shop. There’s nothing but fake “projects” for crap that’ll never exist. Montage bags, catastrophe card game, and pixel dice just to name a few. All utter trash",1,False,bickybybo,Complete garbage,
847,2022-08-19 21:29:30,Kickstarter is such a good app! Very versatile and really helpful for small creators!,5,False,some random nickname 29291001,Very Good App,
848,2022-09-18 19:39:24,No way to change profile info or pics from app.,1,False,TheSharkbite1,Horrible account control,
849,2023-08-09 15:19:02,Not enough visual customization to be worth having its own app,2,False,PastelGray_,Needs a dark mode,
850,2020-04-11 23:45:35,There’s not any clear way to read campaign details in the latest UI update. Why would anyone want to pledge without any way to read the details on the app?,1,False,Lollipoppe,Terrible update,"{'id': 15085582, 'body': 'Hi there, thanks for bringing this to our attention. We’re happy to let you know that this issue is now resolved. If you update to version 4.5.0 you should be all set. Let us know if you continue to experience any issues: app@kickstarter.com .', 'modified': '2020-05-04T16:31:12Z'}"
851,2023-09-16 21:28:12,This is a scammers paradise to easily take money. Do not download do not get involved. Kickstarter does not even go by their own rules of refunds when you don’t get a successful funded projects.,1,False,Just does,Scammers,
852,2019-08-04 06:40:15,The app doesn’t let you view or write comments on the update posts.,2,False,kodora👤,"Ok, but website is better",
853,2023-04-24 21:49:32,Pledged to a project that got $700k and they are not fulfilling or giving any real updates. Kickstarter ignored me but fought my bank so I can’t get my money back. You’ve been warned,1,False,zzzzzzzzxxxxxzzzzzxxzxxzzzxz,Scammers,
854,2022-10-25 07:05:07,Hard to get in contact with and get help about your account. I lost 3 pledges because I can’t get into my account.,1,False,Mr.Rey-Rey,Customer service,
855,2022-10-11 14:03:59,Just going to use the website at this point,1,False,Drydiddy,Constant human verification after sharing links,
856,2022-06-29 16:37:46,As of last app update there are no updates from all the things I have backed.,1,False,queerchameleon,Broken Activity Not Updating,
857,2021-08-27 23:17:43,The entire business model makes it extremely easy for creators to scam backers out of money which Kickstarter takes no responsibility for at all,1,False,Matt_2047,Scam,"{'id': 24811494, 'body': 'Hi, Thanks for your review. Unlike an online shop, Kickstarter is a place for creators to find support for creative projects and the final delivery can come with unexpected hurdles. Remember, backing is not buying. If you have feedback on ways we can continue to improve the backer experience, let us know: https://www.kickstarter.com/contact', 'modified': '2021-08-30T20:15:01Z'}"
858,2021-05-21 03:14:12,Backed projects are not protecting buyers from sellers who don’t deliver products and Kickstarter does nothing about it or refund purchases from these thieves. They owe me $80.,1,False,wafernilla,Let’s developers rip you off.,
859,2020-12-23 05:15:44,"I have been scammed for over $2000 on this app, me and hundreds of others, The creators can disappear whenever they want and not honor what they are supposed to, and Kickstarter will not get involved at all. Countless times.",1,False,the biggest kahuna,Fraud alert,
860,2017-12-29 07:34:05,Get it before the rest of the world knows it exists.,5,False,Brendan 2me,Cool Stuff,
861,2018-03-31 15:21:24,Bummer.. I even tried to delete it and download it again and it just keeps saying something went wrong,1,False,CalTaylor92 ,Won’t let me sign up or log in,
862,2019-09-13 00:08:49,i wish there was a way to eliminate projects that have ended.  it’s annoying searching for things only to find the project is from 2017.,5,False,see spot,god app but ...,
863,2023-10-31 01:42:02,"Projects can take your money and ghost you. 

Zero recourse. Very little opportunity to research the creators. Front men for the creators can just disavowal any relationship after the money is long gone. 

No longer a way to enable creators, now a go fund me for scam artists. 

Brutal environment. I’d rather take my money and by an existing product. Kickstarter just isn’t worth the risk anymore.",1,False,Scott-DH,Scams Enabled,
864,2023-05-03 11:50:19,I enter my credentials and the login button is unresponsive. And all I wanted to do was check on the vaporware I supported with zero recourse or support from Kickstarter for fraud.,1,False,aviduser69,Can’t even log in,"{'id': 36396762, 'body': ""Hi there,\n\nSorry to hear about these login issues! We recommend force-quitting and reopening the app as a first step. If that doesn't resolve the issue, please check for updates to make sure you're on the latest version. If the issue persists, please get in touch at app@kickstarter.com and we'll be happy to investigate further!\n\nBest,\nKickstarter Support"", 'modified': '2023-05-08T14:40:39Z'}"
865,2023-01-19 06:31:33,Completely fails to protect users from scams. I liked helping small businesses start something new but the company refuses to protect users from scams.,1,False,Sarcastic Lemonade,Does not protect investors,
866,2021-06-11 01:08:50,"I have a Kickstarter account. I put in my email address and password, but the Submit button doesn’t work.",1,False,13ccx1175,Can’t Login,
867,2020-08-18 12:19:34,Kickstarter was a cool place but has turned into a place that harbors con artist. The place is full of rip offs and Kickstarter will not help you when your money is stolen. Stay away.,1,False,hwnfisherman,Stay Away unless you like getting robbed,
868,2020-09-13 17:52:22,I like the app but I don’t know how to update my payment info and it is confusing me,3,False,herminesao,I like the app but,
869,2019-03-29 06:49:50,I have backed over 8 projects unfortunately the MAYORITY have just stole my money. Kickstarter doesn’t refund you nor do they help you obtained the money back. I truly believe you should wait for the products to become real,1,False,DANMEXX,DONT FUND ANYTHING HERE,
870,2017-11-13 07:23:37,I have to go through 5 sections to get to the sections that allow me to see my projects.,2,False,Guys butchers,How do I get to my profile easier???,
871,2023-09-22 01:37:49,"App is basically useless if you’re a project creator, why did you take away all the tools for that on the app",1,False,Violet453,No longer has project creator tools,
872,2021-12-24 23:00:20,I’m keeping my account until my most recent campaign fulfills and then deleting it. Congratulations on chasing away backers with a short-sighted commitment to crypto.,1,False,JeFF Stumpo,Blockchain is losing you a supporter,"{'id': 27061620, 'body': 'Thank you for your feedback. To be clear, the Kickstarter experience you’re familiar with will stay the same. Backers can continue to use normal currency to back campaigns and creators will continue to receive normal currency to fulfill their projects. Please visit kickstarter.com/protocol for more information about our announcement.', 'modified': '2021-12-27T02:20:44Z'}"
873,2022-10-03 03:07:35,"I had full faith in kickstarter.
I have so many complaints with some of these so-called creators.
I have expressed my concerns to all of them  that. I felt cheated by.
I heard from none of them.
Kickstarter has done nothing.
I will never order anything from kickstarter.
They are not a  honest company.",2,False,Sergio462,Not so good,
874,2018-06-21 03:17:12,"This is a really neat app if you’re a raging liberal lunatic... everything on here has become some sort of LGBT supporting, anti-gun, pro-abortion, Trump-bashing propaganda. The developers need to rethink their market supporters,
                   Signed,
                            The Silent Majority.",1,False,Goat Whiskers,The most politically charged app in the store...,
875,2024-01-02 13:08:42,"I do not recommend this site, they do not hold their abusers accountable, therefore I cannot recommend this app.",1,False,banannaman,There are more scams than not on this site,
876,2023-12-12 15:37:44,"As soon as you log into your account on the app, it becomes unusable. Nothing loads, just white screens.",1,False,Great to track all my hours,Log in and Nothing,"{'id': 40752267, 'body': ""Hi there,\n\nWe recommend force-quitting and reopening the app as a first step. If that doesn't resolve the issue, please check for updates to make sure you're on the latest version. If the issue persists, please get in touch at app@kickstarter.com and we'll be happy to investigate further!\n\nBest,\nKickstarter Support"", 'modified': '2023-12-18T13:05:09Z'}"
877,2023-06-16 01:50:09,"Trying to read update on a campaign i recieced and get errors saying for backers only, yet i can click and see my pledge. Kind of a mistake…",1,False,MonkayCakes,Not working,"{'id': 37360757, 'body': ""Hi there,\n\nWe recommend force-quitting and reopening the app as a first step. If that doesn't resolve the issue, please check for updates to make sure you're on the latest version. If the issue persists, please get in touch at app@kickstarter.com and we'll be happy to investigate further!  \n\xa0\nBest,\nKickstarter Support"", 'modified': '2023-06-27T14:13:39Z'}"
878,2022-11-23 22:02:43,They allow companies to rip you off and they won’t or don’t do anything about it.,1,False,Creighton 77,Expect to get ripped off…,
879,2022-03-15 19:34:48,Missed an exclusive campaign due to ineptitude by the Kickstarter team. Who could have possibly anticipated time-sensitive crowd-funding might bring high traffic?,1,False,djsosls w,Garbage app can’t handle traffic.,
880,2018-12-30 16:10:45,Let me see new projects and pledge easily,5,False,Tpratt26,Good app for pledges,
881,2022-01-19 14:53:29,"I, like many others, have been scammed. Unfortunately, Kickstarter isn’t responsible for anything, according to their ToS.",1,False,(Monochrome),"Great idea, except the part where people get scammed",
882,2020-09-17 12:28:26,Just stay away from kickstarters. They don’t help with failed projects and don’t take responsibility for allowing thieves and scammers take your money. So just stay away.,1,False,SolaceFlare,Stay away,
883,2018-08-29 02:23:56,"Love the concept of preserving health, the environment, and helping to preserve the dignity of others in need!  A TRIPLE CROWN OF WIN WIN WIN!  Great job!
An Angel Investor",5,False,An Angel Investor,Fabulous project!  WIN FOR HEALTH. WIN FOR THE ENVIRONMENT .  WIN FOR HUMANITY,
884,2018-06-12 02:08:29,"we will highly appreciate if Kickstarter will coordinate ""well"" with seller to help backer to solve our issues with seller.",3,False,RussIsReal4.0,re: seller,
885,2018-04-02 04:10:11,Why make something that won’t allow you to even sign up “something went wrong” - that just doesn’t help the endeavor :(,1,False,alejandrolalinde_dp,Can’t even sign up,
886,2018-03-19 19:56:16,"I backed a ZNAPS Kickstarter project 2 1/2 years ago, and I  and others have not received the products that we have paid for. Kickstarter should support it's backers, but this has not occurred.",1,False,DCJ001,Products not received,
887,2022-11-27 14:31:28,Half of campaigns I back have bee a scam. Kickstarter doesn't take responsibility for anything. So bad and sad because due to the bad experience I won't back campaigns anymore.,1,False,cesards_,Scam Service. OK App,
888,2022-03-15 05:12:13,Great App for people wanting to have the newest gadgets before anyone else,4,False,Rodneyjwv,Gadget geeks Dream.,
889,2021-03-22 21:52:50,Hey there everyone been using kickstarted for a few years only leaving this rating as nothing is currently loading in the app.,1,False,Nombru,App not loading,
890,2018-10-21 08:31:49,"Kickstarter has many fake projects and it doesn't refund the customers when the project creators cheat.
Simply it takes the percentage and enjoy its share.",1,False,Siva Gunda,Many fake projects,
891,2022-01-19 20:20:55,"Get on to the first, great technology and more.",5,False,INRCHLD,Great,
892,2018-04-02 23:11:06,"Login has been broken for days on app. Even when when not logged in, nothing shows. Web site works.",1,False,Kaarukun,Login is broken,
893,2017-11-17 15:30:25,"Version 3.8 crashes! Every time I access a campaign I’m currently backing or previously backed or via the search feature or any method, it crashes.  Please fix this!",1,False,Potours,Crashes,"{'id': 1824305, 'body': 'Sorry about that! We fixed this issue in our latest release, so the app should stop crashing with the most recent update.', 'modified': '2017-11-22T18:42:13Z'}"
894,2024-02-21 20:39:50,After many successful campaigns i finally got took. To the tune of 200$. Camp chair. A year past due now. 100 emails. Very confusing. The developer should be in jail with Trump,1,False,buster2022,Careful,
895,2023-07-05 15:33:58,"Kickstarter on the web works fine for me, but the app blocks me from logging in. I’m getting error messages that the app thinks I’m not a human? Ugh",1,False,ZoyaBee,"App errors, blocking login","{'id': 37587038, 'body': 'Hi there,\n\nWe’re working to resolve this issue at this very moment. In the meantime, we recommend accessing your account via a browser. Please don’t hesitate to reach out at app@kickstarter.com if we can help further and thanks for your patience!\n\nBest,\nKickstarter Support', 'modified': '2023-07-10T14:08:32Z'}"
896,2022-08-29 04:08:16,"I will NEVER back another project! No accountability for the developers and no support from Kickstarter, DO NOT download this app unless you want to give your money away!!",1,False,jM(11),Scams galore!,
897,2022-06-23 21:25:33,"I have an ongoing project that I’m working on, and anytime I have gone to this App, it has no link or reference to it or to my user name!",1,False,Dallygirll,Not User Friendly at All!,
898,2019-09-01 17:53:19,Still waiting on purchase.,4,False,Keeping an open mind,Leggings,
899,2018-09-08 03:21:55,I have already been one three times. Avoid kickstarter as they don't take any responsibility for the scams. All they care about is the cherry on the top. Like mafia bosses they only care about the %,1,False,Dada76,Don't be an idiot,
900,2018-07-23 12:53:18,Rally is a brilliant solution for personal safety. Way to go you guys.,5,False,Murphthesurf6,Rally is impressive,
901,2022-11-22 21:59:38,"Shift Robotics innovation is unbelievable,
combining artificial intelligent personal transportation and wearable technology.",5,False,L54H,Shift Robotics breakout innovation.,
902,2018-07-18 00:26:40,I liked Kickstarter better before they started preaching their politics and force feeding me their social religion in their updates. I just want to back cool projects. I could care less about a bunch of wealthy corporation owners’ ideologies.,1,False,HaHaWorld,Politics,
903,2018-06-24 12:54:09,Stealing money from people is not good and then when you try to get in contact with them they give you the dumbest excuses I think they should be Shut down,1,False,gueldyp,Steelers,
904,2017-11-06 05:52:53,I enjoy searching for new exciting gadgets and tools easily with the app,4,False,Leaderock1,Great app,
905,2023-09-24 14:36:19,"Don’t fall for Kickstarter’s antics. More often than not, you’ll be left with no product and no way to get your money back.",1,False,Lala_523,Scam App,
906,2023-04-11 15:45:15,They claim to vent out scammers on their site but they don’t. To much money wasted on scam projects and they reap the rewards While the consumer loses out on their money.,1,False,Rican Moe,Kickstarter don’t listen,
907,2018-04-13 08:15:46,"With triple A games destroying the game market, kickstart really helps the underdogs.",5,False,Dylan (spiny),Good for companies.,
908,2022-06-16 14:20:36,Can’t sign in without getting a message asking me to verify I’m human then redirecting me back to signing in. It’s an endless loop and makes the app unusable.,1,False,IndustrialManiac,App broken,
909,2020-02-05 16:19:22,The allow fraud on their platform and will not do a thing. Be warned and don’t think that their guidelines will do a thing. Kickstarter lies and they will never email you back.,1,False,Biddy bitty boot,Be warned they allow fraud.,
910,2023-12-05 17:30:48,Have re installed many times and just nothing displays under any tabs .,1,False,2ez 40,No display,"{'id': 40566081, 'body': ""Hi there,\n\nSorry to hear about this issue. Please get in touch at app@kickstarter.com and we'll be happy to investigate further!\n\nBest,\nKickstarter Support"", 'modified': '2023-12-07T20:10:58Z'}"
911,2023-10-28 01:55:01,I don’t have a dashboard in the app. There is no way for me to start my own kickstarter. Seems completely unrealistic.,1,False,dropsmic,No starter kick or otherwise,
912,2022-06-04 17:44:23,This company is a scam. Fake campaigns designed to take your money. Needs more accountability. Taking money from poor seniors then saying there is nothing they can do.,1,False,CANARY614,Scam,
913,2020-06-28 04:28:50,"Watch out ! 
This is the easily the worst app/company I’ve ever experienced.  
Kickstarter stands behind any Low Life that gives them money to rip people off !!! 
I state that from experience.",1,False,kg1778,Low life,
914,2019-06-27 13:37:23,App is ok but Kickstarter is pretty much a host to scammers and does not hold them accountable to fulfill or even try to fulfill their pledges.  Do not pledge any campaign that is not a Artsy type of thing or a board game.  Most of the “tech” projects are scams.,1,False,Caveman_Prog,No accountability by Kickstarter,
915,2018-07-02 00:13:17,"Hard to use, bad interface doesn’t allow contact easily. Designed to take your money and run...",1,False,SuhfferingLions Fan,Poor,
916,2024-04-18 20:02:41,The most useless company in existence. They have brought nothing of value to the world as a whole.,1,False,softwaredwv,Honestly just worthless,
