,date,review,rating,isEdited,userName,title,developerResponse
295,2021-12-16 02:36:22,"Kickstarter has made the decision to integrate cryptocurrency on to its platform and therefore accepting the crypto mining process which involves computers running constantly at high power and outputting huge amounts of CO2.
The process to mine cryptocurrency is accelerating the destruction of the planet and Kickstarter has decided to validate this destructive, energy-intensive process in order to satisfy its investors and has ignored the thousands of creators who have vocally stated their objection.

Do not fund your campaign on Kickstarter.",1,False,ScrapperAlex,Cryptocurrency is Destroying the Planet,"{'id': 26904317, 'body': 'As a Public Benefit Corporation, we have pledged to consider environmental impact in everything we do. In addition to carbon offsets, Celo is a “proof of stake” blockchain, requiring 0.0003% of the energy usage on Ethereum or 0.00003% of Bitcoin, which are “proof of work” chains. We’ll address this and more in a white paper in the coming weeks.', 'modified': '2021-12-17T21:38:25Z'}"
296,2021-12-13 00:45:53,I have backed 2  projects that did not deliver with no help from Kickstarter. 1 project delivered but did not meet all the basic concepts of the product.  2 other products were filled to specs but were from companies that already produced products. The app itself is not well curated nor does the algorithm work well.  The links are confusing and the purchasing are as well.  Stick away from this app and it’s benefactors.,1,False,McAbee,Does not deliver,
297,2021-05-03 22:45:36,"While I love the platform, the app doesn’t match the experience of the website. When I view the comments on a campaign, everything is show chronologically, so when someone replies to a comment it is unclear what they are replying to. This works fine on the website and needs to be fixed on the app to make it easier to read and reply to other campaign comments.",1,False,InlovewithZombies!,Comments broken,"{'id': 24056711, 'body': 'Hi InlovewithZombies!, thank you for the review and feedback. We’re happy to let you know that we just released comment threads and you can now read all replies in the right place. Make sure you update the app to the latest version (4.13.0) and you should be all set. Let us know what you think!', 'modified': '2021-07-21T19:28:54Z'}"
298,2020-03-11 21:56:23,I am a creative who is looking forward to launching my first Kickstarter campaign. I’ve been doing a ton of research on my interest are (comics) and have been pleased to discover that Kickstarter is a more viable way to achieve my goals than ever before!,5,False,Own.Goal.Creations,Aspiring DIY,
299,2017-12-07 13:58:54,"I have funded a lot of projects on different sites but it’s only p. Kickstarter that I have not only never seen the product arrive but not gotten one personal response to a query. Just not good enough .
My soundless headphones are supposedly still in production. After over two years... come on now at least answer personally.
Never had this problem on other crowd funding sites such as Indiegogo, for example.",1,False,cinemaholic,Two projects funded but never received and no personal answers,
300,2024-02-22 18:11:38,"Kindly update your apps to allow all international countries to start their project within the app on AppStore.   Please add create projects on the kickstarter app, also please add all feature within the app.  Please make it functional.

Sharon",5,False,Sharonmilrob,International countries,
301,2022-05-16 02:28:56,"I really like to see innovation and design that isn’t always cookie cutter. Solutions to problems in the making stages. 

Ease of investment. Updates and different levels of sponsorships. Feel like a shark in the tank.",5,False,BigAlHurl,It’s like being in the know… you know?,
302,2020-05-07 18:59:01,Never shows info and pages. Website works fine but app blank. Recent update won’t even allow login. Must use web portal,5,False,Lobster-Overlord,Always glitchy,
303,2019-12-10 13:50:49,"It is so refreshing to the spirit to find the tech creatives who established this site, and to find the artist creatives and lovers who create the projects. 
Hoping to fund my own restart project of traditional film photography soon. May all the good YOU do return to you, 1000-fold. 💖",5,False,sparkle-heart💖,All are true angel financiers,
304,2020-03-26 00:02:52,"Buyer beware if you back a project that gets funded, and then does not come to fruition Kickstarter will not help you get your money back in any way. Their stand is that it is the creators responsibility, all while taking 5% of the funded project. They are no different than the creator of the project that just runs away with the money. In this particular case Kickstarter made out with 5k and we as backers received nothing and no help from Kickstarter just generic terms of service lines",1,False,now former customer1,Kickstarter neglects all responsibility,
305,2020-09-04 19:10:58,I’m excited to see everyone’s ideas.  I love this platform to be able to see people from around the globe’s excitement!!!!!   This truly is a small world.   I really don’t know where I first found out about Kickstarter but I am so glad I did 😊,5,False,Sunnyflorida1998,Excitement,
306,2017-11-11 06:18:33,"Noticed on iPhone X. When in portrait mode, the video playing keeps the x button on upper left... even if you tap the screen once to get the full screen icon. They overlap and the x is on top so if you try to go full screen the app will default to a tap on the x instead. No need for that x anyway IMO.",4,False,Rsxrcr,One UI bug,
307,2024-04-24 16:59:15,It won’t let me delete and change my email address. Other than that it has been wonderful shopping,5,False,Whozgig,My email,
308,2020-08-17 02:23:39,"I love what Kickstarter can do for small a large developers. The only issue I have is with the app itself. My 2 mains issues are I can’t change my pledge from the app, and the comment sections never works. Half the time I don’t know if someone is replying to another comment or not. The comment sections needs to be updated big time!",3,False,wyattwag,"Great program, terrible app.",
309,2021-11-26 18:27:02,If you are a gadget man like I am this is gadget man heaven. Just about everything I have gotten from Kickstarter has been an amazing except for the camp chairs that I got ripped off on by the seller. Other than that I love this place,5,False,Painless66,Love this place,
310,2018-03-16 20:57:53,The latest update has a bug where the comments in updates are displayed in an in-app web browser instead of within the main interface of the app.,4,False,JFlight,"Overall a good app, but latest update has bugs.",
311,2021-05-04 19:17:07,"I understand that every project you back comes with a risk of not delivering, that having said Kickstarter being the middle man should take more action to the projects where users gets scammed and actually nothing get in return. Perhaps they should hold a percentage back until the item has been delivered so everyones money is not a complete waste. Instead they cash there percentage and walk away.",1,False,Wesleyd85,No support for backers,
312,2021-04-23 00:19:48,"The concept is great, but with no guarantee or way to recoup money it makes it not worthwhile to use. Too many times I’ve been burnt by the campaigns I supported, one of the worst was the coolest cooler campaign. Some of these will make millions of dollars and never get the products offered to the people that paid all this money for them. There needs to be some recourse for people who put up money and never receive what they paid for.",1,False,maverik78,Buyer beware,
313,2023-03-26 23:04:26,I just realized that newer comments are not shown first. You have to scroll further down. I just loaded a project and the first comments seen were from last year and this year's were further down. Can that be fixed?,3,True,PinkPiggie1230,Comments don't show most recent first,"{'id': 24056852, 'body': 'Hi PinkPiggie1230, thank you for the review and feedback. We will take your suggestions into account for future releases. In the meantime, we’re happy to let you know that we just released comment threads and you can now reply to other comments. Make sure you update the app to the latest version (4.13.0) and you should be all set. Let us know what you think!', 'modified': '2021-07-21T19:44:43Z'}"
314,2023-09-27 14:36:58,"There are so many scams on kickstarter. I have lost over a thousand dollar on kickstarter backing projects that never came to fruition. Kickstarter does nothing about it - zero accountability. Seeing the number of people scammed, it seems it’s their business model to allow the scams. It’s a shame because there are good product ideas on kickstarter, but I cannot recommend this to anyone given the lack of accountability from kickstarter.",1,False,dev-usr,Scams Galore,"{'id': 39464856, 'body': 'Hi dev-usr,\nWe appreciate your feedback. Projects on Kickstarter are often in the early stages of development, which sometimes means they may not come together as planned. We hear your frustration and do want to help, so please contact us at https://www.kickstarter.com/contact', 'modified': '2023-10-12T01:40:58Z'}"
315,2021-04-22 01:17:21,"The one frustrating thing about the app is that when selecting tiers, there is no photographic previews. There are some Kickstarters that have multiple tiers, and it gets frustrating having to go back to the main Kickstarter’s page.",3,False,pillar81,Needs photo previews of each backing tiers’ items.,
316,2021-12-02 18:23:06,They do not stand behind their original policies. Changed policy concerning refunding backers after I funded a project; the promise of the reward was never fulfilled to myself and over 400 people. Out over $250. Kickstart changed their policy after I invested. Now they are doing nothing. DANGER! If they are selling the app they need to stand behind the original policies. Tried contacting the project I sent money to; nothing but cricket sounds. Never again.,1,False,Dottie's I-Tunes,Do Not Use This App,
317,2024-03-03 19:17:52,"Overall good app but ‘activity’ page is slow, sometimes frozen. We need an area to follow up ‘surveys’ that were sent by backers. This app should have all the features of the webpage.

Battery issue last few days taking up to 25% of phone.",2,False,a hill,"Recent Battery killer on iOS -‘Activity’ page is bugged, slow - need ‘survey’ list",
318,2023-12-30 08:46:50,This used to be a legitimate way to fund new projects and help small businesses. But it has been flooded with scammers and fake projects that take your money and never produce. There is not a way to have real communication with either kickstarter or the project company. This site has no accountability.,2,False,Mommy loves Lila,Most projects are scams and there’s no way to get your money back,
319,2023-12-29 15:16:24,.no dark mode. no comment reply notifications. poor parity with the desktop web experience. no meaningful app enhancements made or announced in years. Kickstarter has demonstrated they only really care about creators and will only do something to help backers when they truly must.,2,False,megashub,"No dark mode, poor feature parity with desktop web","{'id': 41033357, 'body': 'Hi there,\n\nThanks for taking the time to send along your feedback. The Kickstarter app is constantly evolving and community feedback is what helps us improve. We greatly appreciate your input and will be sure to share it with our developers.\n\nBest,\nKickstarter Support', 'modified': '2024-01-02T15:07:31Z'}"
320,2021-02-07 15:54:10,"This app is helpful and easy to use, and it is very responsive. Makes it easier than using the website.",5,False,YJ Choi,An easily accessible version of the Kickstarter website.,
321,2023-09-02 23:31:49,There can be way to much spam in my inbox I’m not sure what kickstarter is doing about but they need to fix that issue if you don’t have real reason to be in the platform then get off and go find someone else to scam,3,False,Too much scamming,There are to many fake accounts in my inbox,
322,2022-09-09 17:09:14,"Like the title says, I've found the app is useful for searching but horrible for managing and following up. My app didn't notify me of backer surveys needed, I missed one completely and would have missed another if not for checking the website. 

TL;DR Good for searching and backing, but doesn't replace the website.",2,False,helldiver23,Useful for finding kickstarters but not for following up,
323,2022-06-02 16:28:12,"Doesn’t open KS links from a webpage to this app. It will open the app but redirects you back to the webpage. Weird behaviour. Still no dark mode yet considering it was introduced in iOS for how many years now, couple years maybe. 

Good app. Could be more improved.",3,False,Edward the Human,Basic features are needed.,
324,2019-05-29 16:48:54,"Purchased an item on Kickstarter that was supposed to be delivered in May, the seller stopped responding to customers weeks ago and has not even logged in, in over a month.  I reported the project to Kickstarter(after a number of other customers reported the project) and still have yet to hear back.  If you’re looking to give money to someone with no expectation on the return, this is perfect for you.",1,False,Michauxtime,"Paid, and received nothing",
325,2019-04-02 03:11:13,"I love Kickstarter. It’s almost a problem.

So many of these projects talk about shipping/fulfillment timelines in terms of backer numbers, but I can’t seem to find my backer number to save my life unless I write it down when I initially back something. Please add it to projects we’ve backed in a visual, easily identifiable way..",3,False,Rmedic97,Needs easier way to find backer number,
326,2018-01-28 19:27:53,"I have been “burned” by two of the three Kickstarter campaigns I have been part of. One panned-out beautifully, one went to a class-action law suit, and the last was an absolute sham/con job.  

Bottom line, only invest what you can afford to lose.  And...Kickstarter does not get products/clients well, and they offer no zero investment/fraud protection.  Research as much as you can.",3,False,Bunkhmedis,BEWARE!,
327,2024-04-13 02:00:01,Am I missing something? My projects are no where to be found. It’s not user friendly at all. Can’t find my projects to do anything with them. I have to do everything on the website. If I search publically I can find my projects but they aren’t anywhere obvious to me on my profile. Doesn’t make sense. I was so confused I logged in and out 3 times.,1,False,Erica184,Not user friendly at all,"{'id': 43284835, 'body': ""Hi there,\n\nPlease get in touch at app@kickstarter.com and we'll be happy to help.\n\nBest,\nKickstarter Support"", 'modified': '2024-04-15T19:55:49Z'}"
328,2023-02-22 22:43:33,"…the disclaimer is real! Haha. I have back 7 projects a few years ago and have received my perk for 3 of them, and one of the 3 I received doesn’t work. If Kickstarter can’t find anyway to support it’s sponsored projects to ensure they can handle order fulfillment, I think you’re taking a double risk by investing in crowdfunding on this site.",2,False,1fredericksmith1,Cool Platform but…,
329,2022-08-23 11:14:00,"Backed an item that I was really excited for, but never got any updates, other than a welcome to kickstarter, and an approximate date saying when the item would be charged.  Nothing ever again, no charges.   I contacted the vendor and they said they had no listing for my name or order.  No listing for any backing on kickstarter, either.  Might be great for vendors who need backing, but as far as the follow through for the backers?  Absolute GARBAGE!!!",1,False,Miguelito Sanchez,CHEATED!!!,
330,2022-03-01 00:09:47,App used to work fine but as of last week I can no longer view items under the new page of comics. Given that it’s the main thing I look at this is extremely disappointing that I can no longer view and therefore back new projects that may interest me. Reached out and haven’t received a new reply. Would like the app to be fixed someday.,1,False,InjusticeLogan98,Won’t Let Me View,
331,2018-10-29 17:51:51,"This app worked well in its 1st version, & continues to work well. My participation in KS is due to how easily this app is to use. I may miss an email from the creators but the info on the project from app is quickly retrieved and up-to-date.",5,False,piano13,So much fun!,
332,2019-06-05 19:36:38,I backed one project amabrush and that will be my only one. I did not receive the product and they have declared bankruptcy. I will never use Kickstarter again. They do not stand behind the companies they allow to solicit money from unsuspecting customers. Kickstarter should be shut down as I have no idea how it’s legal to operate the way they do. Contacting them is useless as they don’t care. Stay away if you care about your money!!!!!,1,False,22rachel,Beware of losing your money,
333,2019-04-30 11:36:33,"New update with hidden surprise...the most requested feature of all time...finally Kickstarter does something about those that take the money and runs!!  Really need staged releases of the money and monitoring of progress.

Well, I can dream can’t I.

App works fine by the way...",4,False,tjseagrove,Hidden Surprise?,
334,2019-03-06 17:05:40,"Good app to browse the projects and history of the projects I’ve backed. However, there are many enamel pin projects in the Fashion category that I frequently browse. I have no, no, no interest in any enamel pins and am irritated that they clutter this category. Please put them in their own category or some way the filter them away.",3,False,DaveInFortWorth,Good App With One Irritation,
335,2023-06-27 14:46:38,"Putting money into KS is a risk. Risking the money is a conscious choice. Just make sure that you follow the creator and watch got other projects. KS doesn’t. 

KS makes little or no effort to identify creators that are launching a new kickstarter before they have delivered on previous kickstarters thus creating a pyramid scheme. Or the creator changes their name or profile. 

There should be an easy way to identify or even have bankers report a creator who is starting new Kickstarters before the creator has delivered. There isn’t. 

KS continues to fall down here as they get their money and have no interest in shutting down the creator who is floating too many projects and kiting.",1,False,MSRyanInNYC,No accountability. No reason to become accountable.,
336,2021-11-20 00:50:37,"I have backed six projects each exceeding their goals. According to KS ""Project Creators are required to fulfill all rewards of their successful fundraising campaigns or refund any Backer whose reward they do not or cannot fulfill.""

I have never received two projects backed that raised hundreds of thousands of dollars above their goals. Backers have consistently complained to KS with no success. Just beware that even if campaigns reach their goals KS will not support the backers.",1,False,batene,Requirements not followed,"{'id': 26419582, 'body': 'Hi, Thanks for your review. Unlike an online shop, Kickstarter is a place for creators to find support for creative projects and the final delivery can come with unexpected hurdles. Remember, backing is not buying. If you have feedback on ways we can continue to improve the backer experience, let us know: https://www.kickstarter.com/contact', 'modified': '2021-11-22T23:36:23Z'}"
337,2021-07-31 10:15:26,"I’ve invested in 2 projects. 1 of them being Yameida, a water flossing gadget. This was 2 years ago and NO backers received any deliveries! They are selling them online, so it was a successful product that reached production, but they stopped responding or posting updates in March of 2020. With nearly 1,500 comments and complaints, Kickstarter does nothing to remedy the situation. I’m never investing in another project on Kickstarter again.",1,False,Omar027,Terrible service,
338,2019-09-10 03:34:18,"Kickstarter should do more to protect it’s user and backers. I’ve funded 5 campaigns. Two have gone belly up. Another that was funded in 2016 is still giving updates 3 years later that it may go into production soon. One funded in 2017 just went bankrupt in September of 2019 and Kickstarter says we have to contact the company, which is now bankrupt. With these statistics I can’t recommend anyone to back anything on this platform with Kickstarters current viewpoints.",1,False,Newk55,Bad morals,
339,2018-11-27 04:42:47,"You’ll back promising projects that mysteriously go nowhere. All communication stops, trails go cold, nothing, all after it’s typically too late for you to dispute the charge with your bank. 

Kickstarter will talk in circles until you try and get them to admit they’ll do nothing about it, at which point they stop communicating too.

Kickstarter enables people to steal your money with zero consequences for not delivering. This has happened to me on more than one occasion.",1,False,LJBerenguer,Beware!,
340,2017-11-18 03:01:23,The newest update crashes on iOS 11. Can open app and search but crashes when try an open any campaign. Obviously no testing was done prior to release.  It was a good app prior to last update.,5,False,Mac_Dreamer,New update crashs,
341,2022-07-04 19:11:49,Since the last update not seeing new updates under activity. All the suggestion views and such have remained static as well.,5,False,jamespa1,Update broke app,
342,2020-01-17 01:51:30,"My issue is that Kickstarter offers no protection for backer from the multiple scammers promoting items on this platform.
After multiple issues, I will not be supporting the platform any longer",5,False,BKH63,No protection against fraud,
343,2020-08-23 15:23:56,"From a project creator perspective several items ought to improve: 
- receiving timely notifications when new backers joined a project (inconsistent) 
- the ability to preview updates and edit comments on pictures 
- add the ability to attach pictures or videos to comments",3,False,egnanasi,App could improve,
344,2024-03-26 05:28:37,"Love this app.
A place where creativity comes to life.
Also a bonus is the staff , that holds it all together they are the foundation to further success. Dare to adventure the experience to discover treasures of joy.",5,False,Poopsi pop,Kickstarter app,
345,2019-12-21 04:06:12,"I am done with Kickstarter. No accountability and is a great place for someone to make a lot of promises regarding a product and then fail to deliver with no oversight/accountability. I am one of the 20,000 Coolest Cooler backers who were taken advantage of by a corrupt team and then held to no accountability by Kickstarter.

Be warned...4.8 “ratings” at this time but with the many that have had issues with the same as myself (no accountability) I’m sure plenty of these reviews were paid for.",1,False,Ear Muffs,No accountability,
346,2019-12-14 19:00:54,"Kickstarter the platform is great, but the app is mediocre at best. It’s like the engineers have no clue how to build a native iOS app. No support for Apple Pay, no support for automatically adding credit cards, no way to update payment details for a funded campaign, functionality is a small subset of the website, and the app is poorly organized. Deleting the app, there’s no point in using it.",2,False,dtbeltramo,Amateur Hour,
347,2018-12-27 00:15:34,"The app worked fine before the latest update, now all it does is crash. Wish I could go back to 3.9.11. Worked fine before, now apparently kickstarter doesn't want to support iPads. There is no reason to limit the iPad's that can use this app. Have to use a browser and log into actual website now as there are iPads that are no longer supported. I would give no star if I could.",1,True,13243546758,App no longer works on iPad,"{'id': 6426647, 'body': ""Hi there, our sincerest apologies for the frustration this might have caused.\n\nWe've identified an issue with 3.10.0 for users with certain older devices. We've since then submitted a new version (3.10.1), so you should now be able download the latest compatible version for your device.\n\nHappy backing!"", 'modified': '2018-12-17T20:33:50Z'}"
348,2018-06-17 16:21:04,"A nice way to keep track of your backed projects, when it works. It frequently fails to load data, and once it fails, it seems to get stuck in that state despite quitting and restarting the app. This has been true for several years now, so there is something inherent in the way they are placing their calls that is not optimal.",2,False,Woogawoman,Fails frequently,
349,2020-06-10 05:10:12,"The app functionality is excellent in itself in all honesty. However, why not implement the ability to create a Kickstarter campaign from the application?",5,False,suave 2020,Needs ability to create a Kickstarter from app,
350,2022-06-01 11:33:38,"Been scammed on 2 of the last 4 projects I paid good money on and Kickstarter just shrugs it off. Both projects in the last year, the scammer just stops replying after they got the money. Kickstarter says oh well, that’s the risk when you “invest.” It used to be a good place to help good people. Now they allow it to be unregulated and unchecked and you’re helping frauds. I’m done with Kickstarter.",1,False,DeBoXL,Too Many Scammers and No Regulation,
351,2018-05-02 01:41:14,Current version of the app seems to be completely broken. I cannot login through Facebook or with my email. Generally a good app but not in its current state.,5,False,Jamarkus13,Broken update?,
