,date,review,rating,isEdited,userName,title,developerResponse
1343,2013-05-23 13:16:50,"Overall, this app is wonderful. It looks nice; it functions well, and you can do nearly everything you can do on the Kickstarter main site. My only qualm with it is that I can't sort projects in any way beyond by category. I'd like to be able to sort projects by ""Most Funded,"" ""Ending Soonest/Latest,"" etc. That addition to this app would make it wholly perfect.",5,False,notyque,"Great, but I'd like to be able to sort projects.",
1344,2015-02-26 22:26:00,"The new version is clean and social sharing is a nice feature. 

However now my ""backed projects page"" is jumbled whereas before it was ordered from most recently backed onward (ironically I think this update was supposed to fix that even though I didn't have any problems before). Can we get a feature to change how my backed projects are ordered? I'd especially find it useful to see them organized by ""time remaining"" and ""most recently backed"".",3,False,ItzJayBay,Clean and well done but backed project page is a mess now,
1345,2015-01-26 05:44:45,"Since downloading the new app I have saved loads of money by not backing any projects. I use KS primarily on my phone and since I highly dislike the user friendly-less new app I haven't browsed any projects to back. I hope this is fixed soon. 

When I first opened the new app I was thrilled with the flashy graphics but it all went down hill fast as I realized everything (including backer history)  changed to single face tiles that are very bad for browsing. Do not enjoy looking at the new app at all. Going back to the original browsing format (seeing multiple projects at once) needs to be a top priority for the KS team.",1,False,csgoodnight,One good thing.,
1346,2016-08-16 11:20:58,"I love browsing the projects. Getting to starred and backed items is a little bit of a pain. Just that you filter for starred projects and go to account for backed projects. Also, need a filter for ""active"" so past projects can be ignored.

The UI for address editing in surveys is broken. You cannot get to city and state. I have to use the web version and bail on the app. Bad design.",5,False,WAW1783,Use it all the time,
1347,2015-05-15 13:00:35,"Con: It's too easy to impulse buy (support?). But what shopping app doesn't have that ""issue""?

Pros: This app is well-designed for its platform, from top to bottom, and the only complaint any could leverage is the lackluster speed of the search engine, (which spits out results nicely all the same). There's always room for tweaking the interface, of course, but it's a gorgeous app for now.",5,False,Babel Matrix,Impulse (Lack of) Control,
1348,2015-06-10 17:38:04,"It works reliably. However, it could be better if the closed pledges would be separated from the still running pledges. It would also be great if additional pledges can be made more easily. So one can change the original pledge and increase it without hassle - then has an overview of the new total pledge and does not get charged shipping twice for enlarging the original order.",5,False,afvf,"Works, gut...",
1349,2015-04-17 12:56:36,"I was excited when Kickstarter added iPad support. Should have been the perfect vehicle to explore kickstarter. Instead, this app is so terrible that I actually look at Kickstarter less now and only on my laptop. The list of problems is long. To name a few--no mechanism to exist browsing mode to get back to category selection (a browsing app without a back button?), app quits unexpectedly almost every time I use it, selection of a subcategory requires two trips through the menu (don't most users browse a subcategory? Why make that so hard). Even the old iPhone app was better--I wish I still had that!",1,False,eric the alchemist,Terrible update,
1350,2013-07-31 17:47:34,"I recently launched my first project, and this app has been amazing for managing it. It's helped with keeping in touch with my backers, tracking my project, and the occasional update. 

But I also love it for keeping track of my backed projects and seeing what projects my friends have backed too. A very well done app that's surprisingly more useful and addictive than I expected.",5,False,Doc Pop,Fantastic for backers and creators alike!,
1351,2015-01-28 05:14:34,"I installed the most recent update hoping for a better experience than v2.0, but unfortunately that's not what I got.
I have yet to find out if all the bugs I experienced in v2.0 have been fixed, however I encountered a new (at least to me) bug which prevents me from scrolling down past ""Food"" to ""Games"" or anything after it.
I haven't even had the update for long (I installed it 10 minutes ago) and already encountered this bug.
I expect better than this. Kickstarter's ""upgrade"" from a fully functional app to a broken app with an updated look is extremely disappointing.",1,False,Brendan Haines,Still doesn't work,
1352,2014-02-14 03:01:55,"Kickstarter’s app lands solidly in the competent but unexciting category. It works reliably, hasn’t crashed yet & allows you to access all things you would usually access on the website, but other than that it lacks anything that makes using the app enjoyable. 
The UI is odd to navigate, and getting around is a bit unintuitive, but other than that it works fine.
The one thing I would like if this app was universal with an iPad layout that took advantage of the added screen real estate.",3,False,“_M_”,Satisfactory,
1353,2014-04-10 11:38:57,"This app allows the general public to be involved in backing start up businesses, amazing projects and musicians (like the Amazing Jonny Gray).  You can back any project for as low as a few dollars and up to as much as you feel appropriate.

At the time of my review, I have backed 3 projects that I would not have imagined being able to support and be a part of.  Together We Can Make Things Happen!!!!!!!",5,False,@CWGHjim,Exciting!!!,
1354,2013-02-16 07:04:45,"I just launched a Kickstarter campaign for my photo book, Funny Business, last week and had looked for an official Kickstarter app to help me track my progress in one place. This couldn't have come at a better time. 

It's not perfect yet, but it shows me everything I need to see in a simple way. Once they add more search options it will be the whole package. 

Definitely recommended if you're a project creator or just an avid backer.",4,False,Soulstealer79,Great app at an opportune time,
1355,2015-01-17 03:28:27,"I usually charge my iPad when I go to bed. The last thing I do is catch up on all the stuff I didn't have time for during the day. That includes KickStarter. The stupid and annoying inconvenience is that I have to unplug the iPad to read KickStarter.

It can't be read in landscape or upside-down, nope, gotta unplug it or wear my arms out holding it up.

I read everything else in landscape mode with the cord on the right and my iPad cover rolled into a triangular support. I'm typing this review that way now. (One finger hunt and peck)",3,False,Pete the bard,Stupidly inconvenient,
1356,2015-01-15 17:39:57,"And two steps back.

The new look and functionality on the iPad is great, but what happened to viewing ""nearby"" projects? I like to support locals first, and now that has become very difficult. Please bring that feature back!

And if a ""starred"" project ends, there is no way to ""un-star"". At least no way I could find. I've always used the star to tag projects that I am considering, and now if they end I can't get them off the starred list without logging into the web site.",3,False,NoGoodName,One step forward...,
1357,2016-05-22 11:13:26,"FIX YOUR STUPID APP!!!!!!!!!!!!!!
Another update and lowering my rating.  The slightest tap or Hester in the Wong place throws you into left field. Happened 3 times in 5 mins today (wasn't being hyper-vigilant) ironically this is an app featuring innovations :-(

I've updated this a number of times, I've lost track of all the ways you can lose your place, sad....... Removing another star due to my daily annoyance and their lack of a fix, and company not very responsive. :-(

One false tiny swipe and you're in some new category

Going back and re-choosing the orig cat and sort means STARTING OVER. So annoying.

Eg: All Tech, by Newest

30 items in you accidentally swipe slightly vertical and poof!

This usually when I give up and go to bed

Also, sort by magic still gives repeats in the list

The app does seem more stable lately",2,False,87830,***FIX YOUR APP!!!!!!!!!!!*** Make it easier to get back to where you were,
1358,2015-01-27 21:19:22,"I have completely stopped to discover new projects on Kickstarter now - the new app makes it too annoying to get anything done. Very broken UI in the last version, hard to get anything done. Bad, horizontal scrolling, buggy and sudden refreshes that forces you to start over, lack of overview.... So weird that a company like Kickstarter can manage to make their app so much worse.... Oh, and scrolling horizontally is so much much worse than scrolling vertically. Everybody knows it, Kickstarter! Seems like change made only for the sake of design change, with absolutely no User Interaction testing done at all.",1,False,Mutty234,Horrible redesign,
1359,2016-09-12 07:22:28,"Bug in current version that won't return in-place to previous screen or previous scroll spot in project category Que when reverting back from a project selected. So after 5mins of scrolling to a KS I'm interested in, when I finish viewing and hit back page, it reverts me back to start point making me rescroll and scroll and scroll and scroll to get back to where I left off..  Other then that, awesome",4,False,Crash into me...,Great... But Back page misses,
1360,2016-03-01 23:28:23,"After having read some complaints concerning the Kickstarter app, I gotta say that I can't share this view - I found that the app works just fine :) 
What I like most so far, is that when you open it, the section ""staff picks"" shows up, I think it's really interesting and fun to see what the creative heads at Kickstarter consider worthwhile checking out :D 
Keep up the good work, you guys rock!",5,False,Lisa Kirmsse,Great App,
1361,2015-01-06 01:47:00,I like the app as a way to keep up-to-date on projects I have backed. It's not as convenient to find new projects & I tend to go to my laptop for searching. One thing I would love to have added is an easy way to verify if you submitted a survey response. The website offers it and it would be great to be able to see at a glance that it has been completed.,5,False,mel82178,Pretty good app,
1362,2016-01-31 15:58:13,"I love being able to see and support the ideas and dreams of usually everyday folks who want to create something for themselves and others.

I've backed 34 campaigns over the last few years.  Most were successes, some crashed and burned, some never got off the ground.  I've passed over plenty of campaigns that didn't interest me or I thought were poorly conceived.  I also avoid getting sucked into the triads of the whiny, self righteous few who often can't see the forest for the trees.  These are the things you have to do if you invest in something.

I agree with a lot of the complaints about the app, and that's why I didn't give it more stars, but don't let the lousy app keep you from this experience.

Just remember no idea is risk free and there are no guarantees.",3,False,3ringbinder,Don't let the crummy app put you off ...,
1363,2015-10-17 03:05:18,"If you exit a campaign there is no back button. You have to star it first to get back to it more easily. 

Should be an option to cancel a pledge. There are two I am in and is approaching or more than 1 year behind delivery schedule. 

Both are camera accessories and selling my system now would mean these gadgets would be useless on delivery since I'm looking at a different platform.",4,False,ep1curus.sage,Great way to discover innovative projects,
1364,2014-08-22 18:53:56,"As an investor I'm always looking for opportunities to assist ambitious entrepreneurs realize their visions. Kickstarter allows me to 'invest' smaller sums (i.e., & $2500 or less) in projects that yield products that are cutting edge. Too, Kickstarter gives me the access to review progress toward goals & production. The app works well & I use it nearly every day to check on projects I've backed & look for new ones to invest in.",5,False,U. S. Patriot,Kickstarter fills a niche perfectly,
1365,2014-08-18 03:43:12,"Title says it all, this app will not let you filter or sort within categories for what's new. How about a ""New today"" push notification we can turn on for subcategories we like?

I really like the profile review, backer history and activity feed area for the things I have already backed. But on-the-go what I really want is a notification of when something new is listed in a category I like.

This phone app gets some stars for managing existing pledges though! It's good for that",3,False,Ravenbraid,Can't sort on what's new,
1366,2015-09-24 00:07:01,I like having a kickstarted app but it's not as clean as I'd like it. It's hard to find things unless you know the right name. I guess because of the size of a phone it's hard to browse and see much. Also I don't like how the list of my starred projects are chronological with the oldest starting first. I have to scroll through to find the projects that are still open! But it's great to have an app and it makes things easier.,4,False,ReaderBee,Ehh,
1367,2015-03-12 13:36:32,"UPDATE: The new UI is a significant downgrade. The amount of data visualized is less. It has higher friction to distill to what you want. Previously you could wad through the data quickly, not any more. It's so challenging and time consuming now, it has adversely affected my backing to the point where I seldom use the App at all AND I'm backing significantly fewer projects due to the difficulty with the App UI. Previously, I had gotten to the point where I was both finding and backing ALL my projects through the App.

/UPDATE

Recently Kickstarter disabled the notification you received 24-48 hours before a project you had backed would end.

This is an incredible useful tool. Not having it forces the user to create notifications/reminders. There is no good reason for KS to remove this on behalf of the users. Except to prevent people from discerning whether to rescind a pledge towards the end of a campaign.",1,False,Gmichael99,Re-enable backed campaign end notification!,
1368,2015-01-16 13:29:02,"Just because you can- doesn't mean you should! 
This UI is wrong on so many levels... Navigation is annoying and too time consuming, categories dummied down and the use of words like MAGIC is downright infantile, horrible use of color throughout, more dead space than content on screen, etc. etc. etc...
I used to fund projects all the time thru the app.. This update killed any incentive for me to even make the effort checking it out. I bet the flow of funds overall is about to come to a crawl.. 
Oh well.. Can't fix stupid.. But you better fix (or better yet.. Revert) this app if you want KS to survive.",1,False,tk>kg,Unusable!,
1369,2015-08-08 19:27:01,"I've never had a problems with this app. The video playback works well, scrolling through projects is simple, and finding things is easy. The app is well organized and shouldn't give you any problems. I know that if you have any problems, the kickstarter team will fix them, eventually.",5,False,Suryawong,Makes things simple,
1370,2017-05-03 06:52:40,"The latest update opens and closes. It will not stay open so it is completely unusable. Reading the reviews it appears I am not the only one with this issue.

They must not check their app releases, much like the scam projects they don't check out before releasing to their users. Beware of this app version not working just as you should beware most projects aren't posting in good faith and Kickstarter will not do anything to vet scam projects. 

Kickstarter doesn't even return the portion of your money they collected before paying the scammers. Scam or not, that's all profit for Kickstarter.",1,False,Nic Papagiorgio,They broke the app on iPad again,
1371,2016-02-11 23:51:21,"This is a great app to back all those starter companies and idealist. I spend loads of cash backing those with ideas I really support and sometimes I get a gift back. Now, the app has a few hiccups. Sometimes when you mean to go forward to the next item, it goes up instead.  You cannot go back to where you were. The filter options don't really make sense either. More options would be nice.",4,False,whatanutt,So addicting,
1372,2014-10-06 14:07:11,"I was wondering what I was doing wrong that things were getting stuck all over the KS app, so I emailed them. They give me this story that I need to delete the app and redownload it. Sure, that works fine - except for any new content I put on. I'm giving KS a 1 star for dishonesty. If they told me the truth I wouldn't have felt the need to slam them right now - especially since I think they're doing a terrible job in general with how they completely fail to monitor and shepherd their various successful campaigns. Right now I'm peeved that they are the only real game in town (IndeGoGo way too small).",1,False,Thintieguy,New version awful - KS won't fess it's their fault,
1373,2016-06-07 01:56:02,"I've just recently joined. It seems to be easy and straightforward to pledge. The search function needs some tweaks. There needs to be a better way to hone in to more specific areas; type bicycle and get more projects for Bicycle Cards than actual bicycles to ride.  Side scrolling not a big fan. And major categories should have more subcategories, back to search issues again. It's nice to find things to help out, but overall too laborious.",3,False,afpsych,Nice ideas for creative minds,
1374,2017-05-07 15:10:23,"Often apps based of a website are forced to streamline things pair down funtions but thats not the case with the Kickstarter app.
It allows me to do everything I can do on the website its good enough that, by default, I use the app more than Inuse the website.
If you are a frequent Kickstarter user the app will come in very handy.
Enjoy!!",5,False,RichR67,Functional and easy to use,
1375,2015-01-16 04:57:39,"I've backed way too many projects, thoroughly enjoy kickstarter, but this app is like they're trying to be too ""artsy"" rather than show the projects.  Seems like such a waste of real estate swiping across few by few rather than just showing all in a nice gallery view like their site.  Just doesn't seem as thought out as their site or the iPhone app.  The iPhone I get, you can only show so much, but the iPad as so much more room, why waste it?",3,False,Webberto,"Like kickstarter, not a fan of this app",
1376,2013-11-14 20:49:02,"Great app and I love getting project updates as notifications instead of having them fill up my email box.

I wish the notifications were removed from notification center when the app is launched, however, so I didn't have to manually clear them all the time.",5,False,@jvelgos,"Love the app, wish the notifications cleared automatically",
1377,2015-05-10 19:33:11,"I'm not sure if it has something to do with the new Cookie Policy or not, but my stared project list is no longer updating. I have recently stared a few new projects and removed a few stars from projects I'm no longer interested in, but my stared project list remains the same. It's a bit frustrating as I use that list to keep up to date with the projects I am interested in and to make sure I don't miss backing a project before it closes. Please fix this problem that didn't exist until the other day.",2,False,Fire Bongo,"Love Kickstarter, hate the update",
1378,2017-07-05 19:50:00,"So, I see people raging about the Kickstarter company as a whole and how they have gripes with them. News flash! This is an area for reviews on the quality and conciseness of all around the mobile application only.
I like the app. It seems to be smoothed out and polished for seamless viewing and manipulation of supporting projects on the site. Could use more lemon zest.",5,False,Chandelin,Well thought out,
1379,2013-06-08 11:35:28,"You know it's a great app when you would rather use the app than the website. I find it much easier to navigate projects using the app, which had helped me to find a lot of great ideas to back. The organization here seems a lot more intuitive and there are fewer clicks to get to projects that are still active. As soon as they come up with a native iPad version, I'll be rating it 5 stars.",4,False,Cheesetony,Easy to Use,
1380,2016-11-28 21:26:01,"I absolutely hate the new app format! First, I can't access my pledged campaign history - the app only shows active and the first 3 or 4 recently ended or canceled campaigns.  I can only see older campaigns by opening the notifications preferences in Settings. What's up with that???The GUI is also less friendly and intuitive. 2 out of 10.",5,False,Ellah's dad,Why mess with a good thing????,
1381,2015-08-03 14:30:48,"Stable app that does not crash.  Backing a kickstarter is relatively easy.  However, similar to what others have mentioned, the search needs refinement.  When I'm looking for a particular category or subject, sometimes it takes 5 or 10 different phrases to develop a cross section of what is available.  Also, an optional, opt in feature that suggests kickstarters based on what you have backed would be nice.",4,False,Darkseidofthemoon,Kickstarter Rating,
1382,2015-01-31 23:19:16,"They've taken a bunch of whacks with this new update and they have a few things to work out... But I think the new update is absolutely beautiful and time will be on kickstarters side. They are out ahead of most mainstream apps and so it might not feel natural compared to static vertical feeds like insta or fb. But this UI is going to change things... 
Job well done.",5,False,fightwolfcbd,Stunning.,
1383,2015-03-01 00:43:13,"At one time you could sort by proximity which was great but it has been done away with for some time.

What has really annoyed me recently is that they've screwed up responding to surveys.  If you have to type something and have to select the spot to type it defaults to the center and won't let you type, it's extremely difficult to get it to select the far left but if you are lucky you'll manage about one in twenty at which point you can enter your information.  Needless to say responding to long surveys is very annoying.",1,False,Random1543212,The app has been going downhill,
1384,2017-05-11 04:47:15,"I backed the Znaps project on Kickstarter and, after months of stalling and lying, the project creators stopped communicating with backers altogether. However, even though they never shipped the rewards to backers (or even communicated why the didn't) they began selling their item on the internet. 

I tried sending a message to Kickstarter to report this violation of the KS terms of service but received no response. Since I know KS wouldn't be the kind of company that lets creators do whatever they want as long as KS gets their cut of the money I can only assume that the app didn't send my message to KS, thus warranting a 1 star review.",1,False,Edge035,A waste,
1385,2017-03-22 01:35:15,"I've been an ardent Kickstarter fan for some time, and have backed many projects. Unfortunately, it appears that Kickstarter has changed its focus. I've been the victim of two projects that appear to be scams. The project creators appear to have absconded with over a million dollars in pledges with no intention of completing the projects. I completely understand the concept of 'not buying a product', but blatant frauds should be dealt with swiftly by Kickstarter. It appears that once they receive their cut, Kickstarter doesn't care about those who pledge. What a shame.",1,False,Donald Laird,Kickstarter does not hold to its terms of service,
1386,2015-09-30 05:10:31,"I find the function of the app unintuitive. It's easy to swipe between projects accidentally (very frustrating when reading a long description), but impossible to navigate from a project update in your activity feed directly to the project page to check the funding level and other details. Honestly the mobile website beats this, save the storage on your device. The two stars is simply because the app seems stable enough even if it could use some work.",2,False,Cobalt Wraith,Poor design,
1387,2015-08-12 17:37:28,I backed a project for $250 and when it closed I was waiting for my survey etc...  Somehow I had two accounts.. Idk the Facebook account and regular email... Something happened.  Well I contacted customer support via email and within a week and verification of my account it was fixed!!!  A+ customer support!!!,5,False,Fade2blk,"The app is good, customer support is better!!!",
1388,2014-05-21 17:25:30,"The app is definitely well-designed and you are able to research any project that you'd like, but since I originally registered with my Facebook account and this app let me log in with you, there's no way for me to use it to actually find any projects or even save them for review later.  Clicking the ""log in with Facebook"" button only gives an error and then returned to the app.",4,False,Mr. Rubbertoe,"Great, but...",
1389,2015-05-20 14:15:54,"For viewing projects it works fine, but the layout is clunky when it comes to listing them. Horizontal scrolling through projects is terribly annoying. Vertical scrolling and being able to see more than one listed project at a time would be nice. The app is trying to be unique in its layout and design, but it just feels clunky and annoying.",4,False,Pyitoechito,It does the job,
